<?xml version="1.0" encoding="UTF-8"?>
<!DOCTYPE enrich SYSTEM "dtd/enrich.dtd">
<enrich>
  <defaultDatabase>
    <driver>com.mysql.jdbc.MySQLDriver</driver>
    <url>myql://localhost:3306</url>
    <username>test</username>
    <password>test</password>
  </defaultDatabase>
  <elements>
    <element>
      <srcPath>/some/xpath</srcPath>
      <sql>select name from people where name=?</sql>
      <!--dstPath>/some/other/xpath</dstPath-->
      <!-- optional unique DB -->
      <!--database>
        <driver/>
        <url/>
        <username/>
        <password/>
      </database-->
    </element>
  </elements>
</enrich>
